version=0.4.1
basic_cpuid[0]=0000000d 756e6547 6c65746e 49656e69
basic_cpuid[1]=000706a1 00020800 cff82223 1f8bfbff
basic_cpuid[2]=00feff01 00000000 00000000 00000000
basic_cpuid[3]=00000000 00000000 00000000 00000000
basic_cpuid[4]=00000121 0140003f 0000003f 00000001
basic_cpuid[5]=00000000 00000000 00000000 00000000
basic_cpuid[6]=00000004 00000000 00000000 00000000
basic_cpuid[7]=00000000 20944283 00000000 ac000400
basic_cpuid[8]=00000000 00000000 00000000 00000000
basic_cpuid[9]=00000000 00000000 00000000 00000000
basic_cpuid[10]=07300402 00000000 00000000 00000603
basic_cpuid[11]=00000001 00000001 00000100 00000000
basic_cpuid[12]=00000000 00000000 00000000 00000000
basic_cpuid[13]=0000001b 00000440 00000440 00000000
basic_cpuid[14]=0000001b 00000440 00000440 00000000
basic_cpuid[15]=0000001b 00000440 00000440 00000000
basic_cpuid[16]=0000001b 00000440 00000440 00000000
basic_cpuid[17]=0000001b 00000440 00000440 00000000
basic_cpuid[18]=0000001b 00000440 00000440 00000000
basic_cpuid[19]=0000001b 00000440 00000440 00000000
basic_cpuid[20]=0000001b 00000440 00000440 00000000
basic_cpuid[21]=0000001b 00000440 00000440 00000000
basic_cpuid[22]=0000001b 00000440 00000440 00000000
basic_cpuid[23]=0000001b 00000440 00000440 00000000
basic_cpuid[24]=0000001b 00000440 00000440 00000000
basic_cpuid[25]=0000001b 00000440 00000440 00000000
basic_cpuid[26]=0000001b 00000440 00000440 00000000
basic_cpuid[27]=0000001b 00000440 00000440 00000000
basic_cpuid[28]=0000001b 00000440 00000440 00000000
basic_cpuid[29]=0000001b 00000440 00000440 00000000
basic_cpuid[30]=0000001b 00000440 00000440 00000000
basic_cpuid[31]=0000001b 00000440 00000440 00000000
ext_cpuid[0]=80000008 00000000 00000000 00000000
ext_cpuid[1]=00000000 00000000 00000101 2c100800
ext_cpuid[2]=00000000 00000000 00000000 00000000
ext_cpuid[3]=00000000 00000000 00000000 00000000
ext_cpuid[4]=00000000 00000000 00000000 00000000
ext_cpuid[5]=00000000 00000000 00000000 00000000
ext_cpuid[6]=00000000 00000000 10008040 00000000
ext_cpuid[7]=00000000 00000000 00000000 00000100
ext_cpuid[8]=00003027 00000000 00000000 00000000
ext_cpuid[9]=0000001b 00000440 00000440 00000000
ext_cpuid[10]=0000001b 00000440 00000440 00000000
ext_cpuid[11]=0000001b 00000440 00000440 00000000
ext_cpuid[12]=0000001b 00000440 00000440 00000000
ext_cpuid[13]=0000001b 00000440 00000440 00000000
ext_cpuid[14]=0000001b 00000440 00000440 00000000
ext_cpuid[15]=0000001b 00000440 00000440 00000000
ext_cpuid[16]=0000001b 00000440 00000440 00000000
ext_cpuid[17]=0000001b 00000440 00000440 00000000
ext_cpuid[18]=0000001b 00000440 00000440 00000000
ext_cpuid[19]=0000001b 00000440 00000440 00000000
ext_cpuid[20]=0000001b 00000440 00000440 00000000
ext_cpuid[21]=0000001b 00000440 00000440 00000000
ext_cpuid[22]=0000001b 00000440 00000440 00000000
ext_cpuid[23]=0000001b 00000440 00000440 00000000
ext_cpuid[24]=0000001b 00000440 00000440 00000000
ext_cpuid[25]=0000001b 00000440 00000440 00000000
ext_cpuid[26]=0000001b 00000440 00000440 00000000
ext_cpuid[27]=0000001b 00000440 00000440 00000000
ext_cpuid[28]=0000001b 00000440 00000440 00000000
ext_cpuid[29]=0000001b 00000440 00000440 00000000
ext_cpuid[30]=0000001b 00000440 00000440 00000000
ext_cpuid[31]=0000001b 00000440 00000440 00000000
intel_fn4[0]=00000121 0140003f 0000003f 00000001
intel_fn4[1]=00000122 01c0003f 0000003f 00000001
intel_fn4[2]=0001c143 03c0003f 00000fff 00000001
intel_fn4[3]=00000000 00000000 00000000 00000000
intel_fn4[4]=00000000 00000000 00000000 00000000
intel_fn4[5]=00000000 00000000 00000000 00000000
intel_fn4[6]=00000000 00000000 00000000 00000000
intel_fn4[7]=00000000 00000000 00000000 00000000
intel_fn11[0]=00000001 00000001 00000100 00000000
intel_fn11[1]=00000006 00000002 00000201 00000000
intel_fn11[2]=00000000 00000000 00000002 00000000
intel_fn11[3]=00000000 00000000 00000000 00000000
intel_fn12h[0]=0000001b 00000440 00000440 00000000
intel_fn12h[1]=0000000f 000002c0 00000000 00000000
intel_fn12h[2]=00000000 00000000 00000000 00000000
intel_fn12h[3]=00000040 000003c0 00000000 00000000
intel_fn14h[0]=0000001b 00000440 00000440 00000000
intel_fn14h[1]=0000000f 000002c0 00000000 00000000
intel_fn14h[2]=00000000 00000000 00000000 00000000
intel_fn14h[3]=00000040 000003c0 00000000 00000000
